{
  "meta": {
    "version": "v5.6.0",
    "module": "schedule-planning-forecast-horizon",
    "status": "preview-foundation"
  },
  "summary": {
    "title": "Schedule Planning & Forecast Horizon",
    "horizon": "2026-07-01 through 2026-09-30",
    "generatedFrom": "Published patterns, approved leave, training holds, qualifications, coverage minimums, visibility policies, and draft planning rules",
    "coverageDays": 92,
    "openSpots": 18,
    "conflicts": 7,
    "recommendedOtPosts": 9,
    "likelyMandates": 3,
    "qualificationGaps": 2
  },
  "forecastRuns": [
    {
      "id": "forecast-q3-2026",
      "name": "Q3 staffing forecast",
      "range": "Jul 1\u2013Sep 30, 2026",
      "status": "needs review",
      "issues": 18,
      "owner": "Scheduling Supervisor"
    },
    {
      "id": "holiday-weekend-2026",
      "name": "Holiday weekend stress test",
      "range": "Jul 3\u2013Jul 6, 2026",
      "status": "high risk",
      "issues": 6,
      "owner": "Admin"
    },
    {
      "id": "training-block-2026",
      "name": "Training block simulation",
      "range": "Aug 10\u2013Aug 24, 2026",
      "status": "watch",
      "issues": 4,
      "owner": "Supervisor"
    }
  ],
  "forecastIssues": [
    {
      "date": "2026-07-04",
      "window": "0600-1800",
      "type": "under minimum",
      "severity": "critical",
      "detail": "Dispatcher coverage projected below minimum by 2.",
      "recommendation": "Post VOT and prepare mandate queue if unfilled."
    },
    {
      "date": "2026-07-05",
      "window": "1800-0600",
      "type": "qualification gap",
      "severity": "warning",
      "detail": "No EMD-qualified employee assigned to night shift.",
      "recommendation": "Swap qualified employee or assign overtime."
    },
    {
      "date": "2026-08-12",
      "window": "0700-1900",
      "type": "training overlap",
      "severity": "warning",
      "detail": "Two radio-qualified employees in training during day shift.",
      "recommendation": "Adjust training or generate coverage exception."
    },
    {
      "date": "2026-09-02",
      "window": "1300-1700",
      "type": "early-in mandate likely",
      "severity": "watch",
      "detail": "Short-day coverage gap connected to next night shift.",
      "recommendation": "Review connected-shift mandation policy before posting."
    }
  ],
  "recommendedActions": [
    {
      "action": "Post overtime",
      "count": 9,
      "status": "recommended",
      "detail": "Open windows have qualified volunteers or known VOT candidates."
    },
    {
      "action": "Prepare mandate queue",
      "count": 3,
      "status": "watch",
      "detail": "Forecast projects mandate risk after VOT window closes."
    },
    {
      "action": "Resolve qualification gap",
      "count": 2,
      "status": "warning",
      "detail": "Projected schedule lacks required certified coverage."
    },
    {
      "action": "Review leave conflict",
      "count": 4,
      "status": "warning",
      "detail": "Approved leave creates under-minimum periods in forecast horizon."
    }
  ],
  "heatmap": [
    {
      "week": "Jul 1",
      "risk": "high",
      "openSpots": 6,
      "conflicts": 3
    },
    {
      "week": "Jul 8",
      "risk": "medium",
      "openSpots": 3,
      "conflicts": 1
    },
    {
      "week": "Jul 15",
      "risk": "low",
      "openSpots": 1,
      "conflicts": 0
    },
    {
      "week": "Aug 10",
      "risk": "medium",
      "openSpots": 4,
      "conflicts": 2
    },
    {
      "week": "Sep 2",
      "risk": "medium",
      "openSpots": 4,
      "conflicts": 1
    }
  ],
  "rules": [
    "Forecasts are preview-only until authenticated scheduling writes are enabled.",
    "Pattern projection should never publish directly without supervisor/admin review.",
    "Planning output should feed draft planning, conflict detection, OT posting, and mandation queues."
  ]
}